<?xml version="1.0" encoding="UTF-8" ?>
<!DOCTYPE basesim SYSTEM "basesim.dtd">
<basesim>
  <simul name="mySimul">

    <!-- WorkHolder definition; only one WH per Simul -->
    <workholder name="wh1">
      <dataholder name = "dh1" type="in"/>
      <dataholder name = "dh2" type="out"/>
    </workholder>

    <exstep name="simul1" exname="mySimul" src="lib.xml"/>
    <exstep name="simul2" exname="mySimul" src="lib.xml"/>
    <exstep name="simul3" exname="mySimul" src="lib.xml"/>
    <exstep name="simul4" exname="mySimul" src="lib.xml"/>

    <connect src="simul1" dest="simul2"/>
    <connect src="simul3" dest="simul4"/>
  </simul>
</basesim>
